ResponseId,student_answer,label,q_id,label1,label2
R_124LOg3Tde4RHqU_PSU_q2,"The Null would be Pmen=Pwomen
The alternative would be Pmen>Pwomen
Type 1 would mean you reject the null even though its not true, and there is no correlation between gender and higher education
Type 2 would mean you fail to reject the null, and claim not association when in fact there really is a association. 
 
There isnt really any big consequences here. I guess with type one the university's could spend unneeded funds and invest in programs that aren't actually needed in order to decrease disparities in education between genders. 
Type two on the other hand, could mean resources and programs that are needed would not be pritotized and they would miss on opportunities to bring equality to education 

",2,PSU_q2,,
R_QmJzfcoXOXHfFoR_PSU_q2,"Taking, for example, a girl running a statistical test to see if girls perform better on a quiz than boys given an hour of time beforehand to prepare for the test with prepared study materials. In this example, the null hypothesis would state that there is evidence that girls perform better than boys, while the alternative would show that there is no statistically significant difference. A type 1 error in this context would entail the researcher determining that there is significant evidence that suggests that girls perform better in the scenario, when in reality they do not. A type 2 error would suggest that there is no statistical significance in the performance, when in reality there is enough evidence to suggest that girls perform better. Both errors would result in many consequences, including potentially publishing data that ends up being disproven later.",1,PSU_q2,,
R_2fJ2aUzqhf0DfX1_PSU_q2,"The null hypothesis is a hypothesis that there is no statistical significance between two variables.
The alternative hypothesis is stating there is evidence to reject the null, based on evidence.

A type 1 error occurs if you reject the null hypothesis that is actually true.

A type 2 error occurs if you fail to reject the hull hypothesis that is actually false.

A consequence of a Type 1 Error would be saying the concluded treatment does have an effect when it actually doesn't.
A consequence of a Type 2 Error would be saying the concluded treatment has no effect when it really does",1,PSU_q2,,
R_2rZAeRJVXXgWTCA_PSU_q2,"Null and Alternative Hypotheses:

-Null Hypothesis (H₀): The new drug has no significant effect on the medical condition, any observed differences are due to random chance.

-Alternative Hypothesis (H₁): The new drug has a significant effect on the medical condition; the observed differences are not due to random chance.

-Type I Error (False Positive):
A Type I error in this context would occur if the researchers incorrectly reject the null hypothesis and conclude that the new drug is effective when, in fact, it is not. This is a false positive, suggesting a treatment effect that doesn't truly exist.

-Type II Error (False Negative):
A Type II error would happen if the researchers fail to reject the null hypothesis when, in reality, the new drug does have a significant effect on the medical condition. This is a false negative, missing a true treatment effect.


Consequences:

-Type I Error (False Positive): If the researchers claim the new drug is effective (when it's not), patients might be exposed to unnecessary treatments. 

-Type II Error (False Negative): If the researchers fail to recognize the effectiveness of the new drug, patients might miss out on a beneficial treatment. 
",2,PSU_q2,,
R_3fYH2EM9pr7SX66_PSU_q2,"In hypothesis testing a type 1 error is when the null hypothesis is rejected incorrectly, leading to the false conclusion that a treatment or intervention is effective when it is not. This can result in unnecessary costs and potential harm to patients. a type 2 error is when the null hypothesis is not rejected, incorrectly concluding that a treatment or intervention is not effective when it actually is. This can lead to missed opportunities for effective treatments and continued suffering for patients. Both types of errors have significant consequences and should be carefully considered in decision-making",0,PSU_q2,,
R_32MewyWGkaNluhq_PSU_q2,"the null hypothesis is that what you are testing, there is no difference between the two variables and the alternative hypothesis is the opposite, stating that there is a difference between the two variables. 
a type one error means that you are saying something has an effect on one variable, when in fact, it does not, so a false positive would occur. 
a type two error means that you are saying something doesn't have an effect on one variable, when in fact, it does have an effect, so a false negative would occur.
with a type one error, you could lose sales and have to do recalls because you thought something worked, when in fact it did not. 
with a type two error, you would also lose money because you are claiming that something doesn't work, when it does, so you are losing money by not promoting the product.",0,PSU_q2,,
R_3JeAQWvsd0m1YR7_PSU_q2,"Null hypotheses: the new medicine has no effect or is not different from the placebo.
Alternative hypotheses: the new medicine has a significant effect, and there is a difference from the placebo.",0,PSU_q2,,
R_PYbhWcT1jydZkKB_PSU_q2,"Question : A study is conducted to see if there is evidence that a recorded phone call is more effective than a mailed flyer in getting votes to support a certain candidate. (WILEY PLUS) 

Null(Ho) = p=0 
Alt (Ha) = p>0 

Type 1 error is when you reject the null but it is true 
Type 2 errors is when the null is false but you fail to reject the null 

If this study had conducted a type 1 error than they would be wasting their resources in sending flyers in the mail. They would think that recording is not more effective, when in reality it is, so the workers would be wasting their time in making flyers when in reality they should be using the recordings. 

If this study conducted a type 2 error than they would be wasting their time on making recordings as they think those are more effective than mail in flyers but in reality they should be making mail flyers as the null should have been rejected.",1,PSU_q2,,
R_ToawT7CcHain2Dv_PSU_q2,"The null hypothesis would be H0: p = 0. The alternative hypothesis would be Ha: p>0. A type 1 error would be when we reject the null when it actually should have been failed to reject. Type 2 error is when you fail to reject the null when it should have been rejected. If a type 1 error occurs then there could be a potential release of something, lets say a drug, that has bad side effects but the error was that no one identified the false claim. Type 2 error is if a person is developing new technology and they come to a point at which they find it will not work properly, but in the end it actually will.",0,PSU_q2,,
R_1DuKzmyCC59FvPk_PSU_q2,"Ho= m=0 Ha=m>0 (A new drug in which if its greater than 0, there are side affects.) If there was a type 1 error, we would reject the null when it was actually true, so we would say there are side affects when there are not and would end up not releasing the drug. If there was a type 2 error, we would not reject the Ho when the Ho is false, so we would sell the drug when there was actually side effects.",0,PSU_q2,,
R_2EuXBGRU92hXVeD_PSU_q2,"Relationship between height and shoe size

Null hypothesis- There is no relationship between height and shoe size.
Alternative hypothesis-There is a relationship between height and shoe size.

Type I error- Rejects the null hypothesis.
Type II error- Fails to reject the null hypothesis.

The consequences associated with each type of error are the type I error could actually be true and the type II error could actually be false.
",0,PSU_q2,,
R_2c7To16zsfD7k7v_PSU_q2,"Reproducing the results of statistically significant experiments is an important part of performing good science.  A psychology experiment in 2008 showed that young adults demonstrated an increased preference for their parents after completing an exercise about death as compared to an exercise about dental pain.[1]  In the study, participants were asked to allocate phone minutes to talk to a parent after completing a randomly assigned activity about either death or dental pain.  A significant result was found with a p-value of 0.03.
Another group of researchers replicated the experiment to see if the results could be reproduced.  In this activity we will analyze a simplified version of their data.
Research Question: Our goal is to show that young adults want to spend more minutes talking with their parents when they are thinking about mortality as opposed to dental pain.


[1] Cox, C.R., Arndt, J., Pyszczynski, T., Greenberg, J., Abdollahi, A., & Solomon, S. (2008). Terror management and adults' attachment to their parents: The safe haven remains. Journal of Personality and Social Psychology, 94(4), 696-717.
""Reproducing the results of statistically significant experiments is an important part of performing good science.  A psychology experiment in 2008 showed that young adults demonstrated an increased preference for their parents after completing an exercise about death as compared to an exercise about dental pain.[1]  In the study, participants were asked to allocate phone minutes to talk to a parent after completing a randomly assigned activity about either death or dental pain.  A significant result was found with a p-value of 0.03.
Another group of researchers replicated the experiment to see if the results could be reproduced.  In this activity we will analyze a simplified version of their data.
Research Question: Our goal is to show that young adults want to spend more minutes talking with their parents when they are thinking about mortality as opposed to dental pain.""


- describe the null and alternative hypotheses for the chosen example: 
mu1-mu2 = 0
mu1-mu2> 0


- explain the meaning of a type 1 error (i.e., a ""false positive"") in the chosen context: A Type 1 error in this context would occur if the researchers falsely conclude that there is a significant difference in phone call allocations between contemplating mortality and dental pain when, in reality, there is no genuine difference.


- explain the meaning of a type 2 error (i.e., a ""false negative"") in the chosen context: A Type 2 error would occur if the researchers fail to detect a significant difference in phone call allocations between contemplating mortality and dental pain when there is, in fact, a real difference.


- describe the potential consequences associated with each type of wrong decision (i.e., type 1 or type 2 error).
If a Type 1 error is made, we might mistakenly believe that young adults significantly prefer contacting their parents after contemplating mortality over dental pain. This could lead to misconceptions in understanding the psychological impact of different stimuli on family-related behaviors.
Should a Type 2 error occur, we might wrongly conclude that there is no difference in preference for contacting parents after contemplating mortality versus dental pain. This could result in overlooking the genuine psychological effect that contemplating mortality or dental pain might have on young adults' behaviors toward parental interaction.
",2,PSU_q2,,
R_2yfI7lNEZcxqGdj_PSU_q2,"Example of the effectiveness of a new drug. 

Null Hypothesis: The new drug has no effect 
Alternative Hypothesis: The new drug is effective. 

Type 1 Error: Concluding that the drug is effective when, in reality, it doesn't have any effect.
Type 2 Error: Failing to recognize the drug's actual effectiveness.

Type 1 Consequence: The drug getting mistakenly approved for use, resulting in unnecessary costs and potentially exposing patients to side effects without any actual benefit.

Type 2 Consequence: Forgoing a potentially beneficial treatment, leading to missed opportunities for patients to benefit from the medication.
",2,PSU_q2,,
R_3j1bbFwuxfuOoGF_PSU_q2,"Covid testing


Type 1-Having a positive result when a person does not have covid 

Type 2- Not testing positive when a person actually has covid. 

Type 1 would be a person think they have covid and stay at home when they do not need to and type 2 is a person believes they are fine when the in reality have Covid.",0,PSU_q2,,
R_2vYdEsTgSUMSOc6_PSU_q2,"James was convicted of a bank robbery in New Jersey. 
- the null hypothesis is James being guilty of the crime and the alternative would be that he was innocent
- type one errors are when the null hypothesis is rejected when it was actually false
- type two errors occur when we fail to reject the null hypothesis when it was in fact true
- In the case of my example a type one error for James would be if he was convicted guilty when he was actually single. A type two error would be if James was found innocent when he was in fact guilty.",0,PSU_q2,,
R_43fblZLavlwW84p_PSU_q2,"Suppose we are trying to predict percentage of residents who are obese using percentage of residents who ate yogurt once per day:

- Null hypothesis: There is no relationship between obesity and consumption of yogurt.
- Alternative hypothesis: Residents who eat one yogurt per day are less likely to be obese.

- Type 1 error: States that there is no relationship between obesity and yogurt when in fact there is.
- Consequence: losing time and resources

- Type 2 error: States that there is a relationship between obesity and yogurt when in fact there is not
- Consequence: missing an opportunity to change, enhance, and innovate a project.",1,PSU_q2,,
R_1cV1DtGhm19H1Xw_PSU_q2,"The Alternative would be that p-value is greater than 0, and the null would be that p-value is less than or equal to 0. The type 1 error would mean that the null would be proven false, and the type 2 error would mean that the p-value would be less than 0. The potential consequences would be that type 1 would reject the null and accept the alternative hypothesis, and the type 2 would be the other way around.",0,PSU_q2,,
R_42gg7oyH9zP1Zx7_PSU_q2,"A docent who volunteers at the Palmer Art Museum wonders about visitors to the exhibitions featured in his Sunday Docent Choice Tours.  For several tours over several months, he uses technology to randomly pick a visitor and the docent finds out their age, if they are a local or from out of town, their gender, and he counts how many times the visitor yawns during the tour. The docent collects data from 75 visitors total and uses that to answer the research questions he wrote before collecting his data.

 

Suppose one of his research questions is

Do visitors of the Palmer Art Museum who are locals yawn more than those who are from out of town?

the null hypothesis would be mu1=mu2
the alternative hypothesis would be mu1<mu2
Type I error would be rejecting a true null hypothesis, which would be saying out of town visitors of the art museum yawn more, when in reality they don't. 
Type II error would be failing to reject a false null hypothesis, which would be saying both local and out of town visitors of the art museum yawn an equal amount, which they do not.
Consequences of either of these errors would be spreading misinformation and would take all validity away from the research.

",1,PSU_q2,,
R_3nUWC6uET5T9ZJO_PSU_q2,"Example: Is the proportion of students who prefer wegmans greater than the proportion of students who prefer target?
- null: p1=p2
alternative: p1>p2
- A type one error would be finding that proportion of students who prefer Wegmans is greater than the proportion of students who prefer Target when in fact there is no difference between the proportions. 
- A type two error would be finding that the two proportions no not differ when in fact proportion of students who prefer Wegmans is greater than the proportion of students who prefer Target. 
- With a type one error you could be potentially promoting a concept/idea/product that is not necessarily effective or true. With a type two error you could miss out on influential findings/data.",1,PSU_q2,,
R_NWnytvFr0sdt5iF_PSU_q2,"1. The null hypothesis is that the new medicine has no effect on the patients’ outcomes, and the alternative hypothesis is that the new medicine has an effect on the patients’ outcomes.
2. A type I error is when we reject the null hypothesis when it is actually true. This means we conclude that the new medicine works when it actually does not. This could lead to wasting resources, harming patients, or making false claims.
3. A type II error is when we fail to reject the null hypothesis when it is actually false. This means we conclude that the new medicine does not work when it actually does. This could lead to missing a potential benefit, ignoring a better treatment, or losing a competitive advantage.",2,PSU_q2,,
R_2dDRU2yoGvvSJA0_PSU_q2,"1. the null hypothesis for ""does an increase in age cause an increase in resting heart rate""would be that there is no effect or no relation between the two variables. The alternative hypothesis would be as one ages their resting heart rate decreases.
2. type one error would be saying that there is a correlation, but in reality there isn't
3. type two error would be saying that there really isn't any correlation between age and heart rate, when this is actually false
4. consequence for a type one or type two error would be an incorrect conclusion whether the data was miscalculated or misinterpreted. Ultimately giving off the wrong information.",1,PSU_q2,,
R_2YfYUT1xJIjYOxM_PSU_q2,"Null hypothesis equals 0, alternative hypothesis doesn't equal 0. Type 1 error is when you reject the null when its true. The Type II error is when you reject the alternative when that is actually true. If you reject a medicine when it is actually really helpful this could be detrimental to a lot of peoples health.",0,PSU_q2,,
R_3LgOCfaqkHyyWOA_PSU_q2,"Null Hypothesis (H₀): The new drug has no effect on reducing blood pressure.
Alternative Hypothesis (H₁): The new drug is effective in reducing blood pressure.


Type 1:
Meaning: Committing a Type 1 error would imply incorrectly rejecting the null hypothesis when, in reality, the drug has no effect on blood pressure.
Consequences: Patients might be prescribed a drug that doesn't truly lower blood pressure. This could lead to unnecessary medical costs, potential side effects, and a false sense of security regarding their health.

Type 2:
Meaning: Committing a Type 2 error would mean failing to reject the null hypothesis when, in reality, the drug does reduce blood pressure.
Consequences: Patients who could benefit from the drug might not receive it. This could result in untreated hypertension, potentially leading to more severe health issues, increased healthcare costs, and reduced overall well-being.

A Type 1 error in this context would lead to unnecessary medical interventions, while a Type 2 error could result in missed opportunities for beneficial treatment. Both types of errors have real and potentially serious consequences, highlighting the importance of careful hypothesis testing, especially in fields with direct implications for human health and well-being.

",2,PSU_q2,,
R_3dPUvvrie4Acj7j_PSU_q2,"An example that we have seen in a lab is concerned with likeliness of testing for a disease. Ho would state the the subject tests positive for the disease while Ha would state that they don't test positive for the disease. The type I error in this scenario would be the subject testing positive for the disease when they do not in fact have it. The type II error would be the subject testing negative for the disease when they do have it. Consequences are present in both cases. For the type I error, the subject would be forced to undergo unnecessary treatment and deal with the consequences of having the disease when they don't actually need to. In the case of a type II error the subject would go about their normal life potentially falling more ill due to lack of treatment, or potentially infecting others due to lack of knowledge of the presence of the disease.",0,PSU_q2,,
R_278SwhtA9YGoRYT_PSU_q2,Null hypothesis being that the average number of hours of screen time per day for a college student is 4. Alternate hypothesis being that the average is more than 4. Type 1 error would be claiming that the null is false when it isn't and type 2 would be claiming that the null is true when it isn't. Type 1 could lead to false ideas that screen time is too high based on an incorrect assumption. Type 2 could lead to the false ideas that screen time is lower based on an incorrect assumption.,0,PSU_q2,,
R_yQLx7RLSqdVsyyJ_PSU_q2,"For the penguin study, the reasearch question asks, ""Does the data suggets that the survival rate differs when comparing ""banded"" to ""not banded"" penguins?"" The null hypothesis would be H0: p1=p2 and the alternative hypothesis would be Ha: p1≠ p2. A type I error would mean that we found enough statistical significance to reject the null hypothesis that their is no difference in survival rate between banded and not banded penguins, but in reality the null hypothesis is true. This could result in scientists no longer banding penguins, making it harder to obtain data about climate change. A type II error would mean we have not found enough statistical significance to reject the null hypothesis, but in reality we can reject the null and say there is a difference in survival rate between banded and not banded penguins. This could reult in scientists banding more penguins and potentially lowering the survival rate of all penguins.",2,PSU_q2,,
R_2uDt11NpqhwYl9R_PSU_q2,"In the 4.4 lab activity 2: 

1. The null states that the new drug is not significantly better than the current drug. 
The alternative hypothesis states that the new drug is significantly better than the current one and should be prescribed to millions of people. 
2. a type one error in this case would mean that they find that the new drug is more effective, when in reality it is not.
3. A type two error would mean that they find the new drug to be less effective when in reality it is actually more effective. 
4. A type one error exposes patients to the dangerous side effects, doing more harm than good. A type two error prevents patients from receiving the beneficial effects, due to a false belief that it is not effective enough. 
in this case, a type one error is worse.",2,PSU_q2,,
R_1OHV0EUGbGjn5jX_PSU_q2,"Null Hypothesis (H0): There is no significant difference in the mean total body length concerning head length in possums.

Alternative Hypothesis (Ha): There is a significant difference in the mean total body length concerning head length in possums.

Type 1 Error (False Positive):
Definition: Rejecting the null hypothesis when it is actually true.
Meaning in Context: Concluding that there is a significant difference in the mean total body length concerning head length when, in reality, there is no such difference.
Consequences: Misleadingly concluding that there is an association between total body length and head length in possums, leading to potential wasted resources or misguided actions based on a non-existent relationship.

Type 2 Error (False Negative):
Definition: Failing to reject the null hypothesis when it is actually false.
Meaning in Context: Failing to detect a significant difference in the mean total body length concerning head length when such a difference does exist.
Consequences: Overlooking a genuine association between total body length and head length in possums, missing an opportunity to understand an actual relationship that might have scientific or practical implications.",2,PSU_q2,,
R_24q1H4PTcdSSR2p_PSU_q2,"There is no significant difference in lowering blood pressure between the group receiving a new drug compared to a placebo

Rejecting the null hypothesis when it is true. In this context, it would mean concluding that the new drug is effective in lowering blood pressure when, in reality, it has no such effect.
Patients might be prescribed a drug that doesn't actually provide any benefit, leading to unnecessary healthcare costs, potential side effects, and a misallocation of resources.

Failing to reject the null hypothesis when it is false. In this context, it would mean failing to recognize that the new drug does have a significant effect on lowering blood pressure.
Patients who could benefit from the new drug may not receive it, leading to missed opportunities for improved health outcomes. The pharmaceutical company might also miss the chance to market an effective drug.

",0,PSU_q2,,
R_27TJZ6GyHIRPiNK_PSU_q2,"Null hypothesis: A medication has no difference on a person's health
Alternative hypothesis: A medication has a noticeable difference on a person's health

Type 1: Reject the null hypothesis and incorrectly conclude that the medications have a noticeable difference on the person's health.

Type 2: Accept the null hypothesis incorrectly and conclude that the medication has no noticeable difference.

Consequences: Type 1 error you are giving people a medication that is not actually benefiting their health. Type 2 error you are not giving a beneficial medicine to people because you concluded it didn't benefit their health.
",2,PSU_q2,,
