ResponseId,student_answer,label,q_id,label1,label2
R_2s604KdHWmFaYvw_PSU_q2,"An example from lab is flipping a coin. The null hypothesis would be that there is equal chance of flipping heads and tails , or p-hat1=p-hat2. The alternative hypothesis would be that there is a greater likelihood of flipping heads versus tails, or p-hat1>p-hat 2. A type 1 error means we have created a false positive. In other words, we concluded there was a difference when there was not. In this scenario, a type 1 error would occur if we flipped a lot of heads when in reality there was an equal amount. A type 2 error is called a false negative in which we conclude there is no difference when there is. In this case, a type 2 error would occur if we conclude there is an equal amount of heads when in reality there are more. In this scenario there would not be as harmful implications as this is a mundane situation. However, if a type 1 error occurs, it could mean that a drug/substance would be given to a lot of people assuming it does not have harmful side effects when it does. Taking the drug example again, a type 2 error could be harmful if the drug is not given because it does not seem to be more beneficial than what is already available when in reality it would be.",0,PSU_q2,,
R_2dF3zk6LmAPXBzs_PSU_q2,"An example we discussed in the lab is about testing for a new drug. The null hypothesis is that the new drug does not work and is not significantly better than the current drug. The alternative hypothesis is that the new drug is significantly better than the current drug and has better health benefits. 
The type 1 error would be that you believe that the drug has significant health benefits than the current drug, but the new drug truly does not have better health benefits. 
Type 2 error would be that you believe that the drug does not have significant health benefits when truly it does have significant health benefits than the older drug. 
The potential consequences associated with a type 1 error would be that you give the million of people the new drug saying that it is better for your health and it causes the population to suffer new side effects that are worse for your health. For type 2 errors you don't give million of people the new drug thinking it is not better when in fact it can help the population that would benefit from the new drug.",2,PSU_q2,,
R_1nW97j5hvIP9Zw9_PSU_q2,"type 1= null was false but we assumed it to be true
type 2= null was true but we assumed it to be false",0,PSU_q2,,
R_111okYiDX8C5nPu_PSU_q2,"Example: When flipping a coin, will it land on tails more than heads?
Null: P=0.5, Alternative: P>0.5
Type 1 error: We rejected the null hypothesis and found that the coin will land on tails more often when really we had a false positive and the results were actually just due to chance and the coin is not more likely to land on tails than heads.
Type 2 error: We failed to reject the null hypothesis and found that the results were just due to chance, when really that coin does land on tails more often than heads and we missed that there is actually something going on in the data.
Consequences: Type 1 errors can be dangerous if we are testing drugs because people may be prescribed them to help, but they aren't actually doing anything. Type 2 errors can be dangerous because we could miss the chance to give people something that will help their condition because we did not have a significant result.",1,PSU_q2,,
R_2TGmxVViWW9yDdc_PSU_q2,"When looking at if a medicine if actually beneficial or not it is very important not to fall for these errors. Perhaps if our alternative hypothesis shows that patients using this new medicine have an increase in positive health benefits compared to those who are given a placebo, and our null was that there was no difference in health benefits. A type one error would occur if the researchers did not find any benefits when there was in fact positive benefits. A type two error would occur if there was an association found when in fact there is no real association. Making these errors have grave implications since in both instances real medicine is either rejected or replaced by a placebo more or less.",0,PSU_q2,,
R_2VQQoGX9tZ3oj0K_PSU_q2,"The example that I chose from class involved the effectiveness of a new blood thinning drug, in which it was tested in a double-blind experiment against the current (old) drug. The null hypothesis is mu new = mu old, and the alternative hypothesis is mu new < mu old. A type 1 error in this situation would mean that there is evidence that the new drug is better than the old one, when it actually is not. A type 2 error in this situation would mean that there is not enough evidence to say the new drug is better when it actually is. For the type 1 error, the consequences would be worse because we would have people take the new drug thinking it's more effective, when in reality it isn't. The consequences of the type 2 error would be that people would continue taking the old drug when the new drug is actually better. Here, people won't directly be harmed because although the new drug is more effective, they are still taking the old drug that works fine.",1,PSU_q2,,
R_2P0T1vm06zMc5J6_PSU_q2,Alternative hypothesis is the one that states there will be a change due to a treatment. And the null states that there will be no change due to the treatment. Basically saying that the treatment has no effect. Type one error is when you reject the null when you are meant to fail to reject. An example of this in context would be a positive pregnancy test when the person is not actually pregnant. Type two error is when you fail to reject the null when you were meant to reject it. An example is a false pregnancy test when the person is actually pregnant.  Type one can be misleading because it may lead to people believing that whatever the treatment was worked when it actually didn't. And type two can lead to people not knowing that whatever treatment they did worked.,0,PSU_q2,,
R_22Kcdic8VNgu7Yd_PSU_q2,"Consuming a ginko supplement will improve memory.
null hypothesis: mu1-mu2=0
alternative hypothesis: mu1-mu2<0
a type 1 error would mean that we reject the null when the ginko did not improve memory
a type 2 error would mean that we fail to reject the null when the ginko did improve memory
consequences for a type 1 error is that people would be taking a supplement when it did nothing for them 
consequences for a type 2 error is that people would be missing out on something that could help them",2,PSU_q2,,
R_eV95J9IiXUMllJL_PSU_q2,"A type one error happens if you reject the null hypothesis when it is actually true in the population and a type 2 error is if you fail to reject a null hypothesis that is actually false in the population.
type 1: convicting someone of a crime when they are innocent
type 2: when someone tests negative for a sickness when they are actually infected",0,PSU_q2,,
R_3siV9p86KvyxnW3_PSU_q2,"Null Hyptohesis H=0, Alternative H/=0
Type 1 error, H=0, but null is rejected
Type 2 Error, H/=0, But null is failed to be rejected",0,PSU_q2,,
R_3flTLfVWjDQtebW_PSU_q2,"I am going to use the example above about fruit and obesity. The null hypothesis would be that there is no difference in the amount of fruit ingested and obesity. The alternative hypothesis would be that there is a difference between the two. A type 1 error for this situation would be to say that there is a negative correlation between the two when there really is not. A consequence of this could give someone false advice to a healthy lifestyle. A type 2 error would say that there is no correlation between the two, when there actually is. A consequence of this could cause someone to not include fruit in their diet and therefore become less healthy.",2,PSU_q2,,
R_2PaHYZiU5tLdEn2_PSU_q2,In previous homework we had a question about type 1 and type 2 errors regarding taking a vitamin that can help improve health. If there was a type 1 error than the medicine would not work which does not cause a negative health issue but the pill would be useless. If there was a type 2 error then people would not take the pill because they think it is useless but it actually could have health benefits. This means that making one of these errors would not have a drastic consequence but would either be a waste of making the vitamin or a waste of not using it.,0,PSU_q2,,
R_1JRT1VSStf0wERQ_PSU_q2,"Skittle example in class (green skittle). Null is a certain amount of green skittles. alternative is more green.

type 1 rejects the null even though its true

type 2 if you accept even though it is false

false positive on type 1 and false negative on type 2
",0,PSU_q2,,
R_cCFpr1v79p0Hsw9_PSU_q2,"Do majority of the PSU students binge drink? 
Null: proportion<0.5, Alternative: proportion>0.5

Type 1 would be rejecting the null when in fact, alternative is not true. 
Type 2 would be not rejecting the null in fact alternative is true.

People might think PSU students are crazy at partying when in fact they are good students who do not binge drink and throw up on the street.
People might think PSU students are good students who do not drink too much when in fact they show up drunk and high to their morning class.",0,PSU_q2,,
R_e5JPcHLmB0uN87n_PSU_q2,"People spend lots of money on bottled water. But do they really prefer bottled water.
Researchers at Longwood University investigated this question by presenting people
who attended a local festival with four different cups of water. Three cups had
different brands of bottled water, while one cup had tap water.

Research Question: Do members of the Longwood community prefer bottled water?

1. The Null hypothesis = Ho: p=0.75
    The Alternative hypothesis= Ha: p>0.75
2. A type 1 error in this example would be if we reject the null and don't believe that members of Longwood community prefer bottled water. 
3. A type 2 error in this example could be that we fail to reject the null and members of Longwood community do prefer bottled water
4. When you try to eliminate one kind of error, you inflate the other kind of error
",1,PSU_q2,,
R_sSZvlfpX8EcRX8d_PSU_q2,"-Null and hypothesis are the types of hypotheses that you make when laying out the possibilities of an outcome. The null is when nothing happens or changes, essentially a control. The alternative is when the factor you're testing has a significant influence on the tested topic
-a type 1 error is when the data falsely supports the alternative when in reality there is not enough evidence
- a type 2 error is when the data falsely denies the alternative when there is actually enough evidence to support it
-for a type 1 error, someone may take an ineffective medication thinking that it will help, and for a type 2 error someone may avoid taking an effective medication because they think it will not be effective.",0,PSU_q2,,
R_3s6Boc8cOn0fJqZ_PSU_q2,"describe the null and alternative hypotheses for the chosen example;
""Does an instructor's reputation affect ratings of a lecture""
null: u1-u2=0
alternative: u1-u2 (not equal) 0
explain the meaning of a type 1 error (i.e., a ""false positive"") in the chosen context;
False positive is rejecting the null when you shouldn't (instructors reputation does affect ratings)
explain the meaning of a type 2 error (i.e., a ""false negative"") in the chosen context;
Failure to reject the null when you should have rejected it (instructiors reputation does not affect ratings when it actually does)
describe the potential consequences associated with each type of wrong decision (i.e., type 1 or type 2 error).
Change in policy which could negatively affect the school.",0,PSU_q2,,
R_8IewtphkuytjLhL_PSU_q2,"Ho: mu1= mu2   Ha: mu1/=mu2
the average head length of a possum is equal to it's average body length
the average head length of a possum is not equal to its average body length 

type 1 error is if we conclude that the head length is equal to the body length when it is in fact not
type 2 error is if we conclude the head length differs from the body length when in fact it doesn't

type 1 error: we wrongfully assume that the hypothesis test worked even though it did not and so we conclude that the data is wrong when it fact it is right and we could have used it 

type 2 error: can lead to false assumptions about our data and therefore can lead to the spread of false information",2,PSU_q2,,
R_2urJD0xBghgd2gy_PSU_q2,"Null hypothesis: The new medicine has no effect in preventing the virus.

Alternative hypothesis: The new medicine is effective in preventing the virus.

Type 1 error: This occurs if we mistakenly conclude that the new medicine is effective when, in reality, it doesn't work against the virus. 

Type 2 error: This happens if we mistakenly conclude that the new medicine is not effective when, in fact, it does work.

Type 1 error consequences: It could be dangerous to give a sick person a medicine that doesn't work.

Type 2 error consequences: You are wasting the opportunity to use a new medicine that prevents the virus.",2,PSU_q2,,
R_1IMiwrU6w54EzAb_PSU_q2,"-Null Hypothesis: The new drug has no effect or is no better than the existing treatment.
-Alternative Hypothesis: The new drug is effective and produces a significant improvement over the existing treatment.
-In this context, a Type 1 error occurs if the statistical test incorrectly rejects the null hypothesis. This would mean concluding that the new drug is effective when, in reality, it has no significant impact.
-A Type 2 error occurs if the statistical test fails to reject the null hypothesis when it is false. In this case, it means not recognizing the efficacy of the new drug when it actually has positive effects. The consequence of a Type 2 error could be the rejection of a potentially beneficial drug, resulting in missed opportunities for improved treatments and patient outcomes.
-consequence of error type 1: May lead to wasted resources, financial losses, and potential harm to patients who might be exposed to a less effective or even harmful treatment.
-consequence of error type 2:Could result in missed opportunities for medical advancements, leading to prolonged use of less effective treatments and delaying potential benefits for patients.",2,PSU_q2,,
R_1M4VFYls0aWWv26_PSU_q2,"The example I am using from class is: We are testing a new drug with potentially dangerous side effects to see if it is significantly better than the drug currently in use. If it is found to be more effective, it will be prescribed to millions of people

- Ho: dn (new drug)=do (old drug).     Ha: dn>do
- If we did a type 1 error it would mean that we believe the drug has significant health benefits when truly it does not. 
- If we did a type 2 error we would believe that the drug does not have significant health benefits when it truly does. 

In this case doing a type 1 error would be far worse than a type 2 error as we would give a new drug to people that have very dangerous side effects.",1,PSU_q2,,
R_DvIrdD0hzJKtlLP_PSU_q2,"The example that we have discussed that I am referencing is about a memory-enhancing drug called ginkgo. In this case lets say that we are proving consuming ginkgo improves short-term memory compared to others using a placebo in this study. A type 1 error in this context would mean that ginkgo in fact does not improve short-term memory, but our study falsely claimed that it did. On the other hand, A type 2 error would mean that we found evidence that ginkgo improved short-term memory loss when it in fact did not. The consequences for the type 1 error could be giving out this drug to the public and it having no positive effect. The consequences for the type 2 error could be not releasing this drug to the public when it could be helping people.",1,PSU_q2,,
R_3JeIZLdVFUQHjFM_PSU_q2,"Example: 70% of Penn state students own an iphone. 
Null: H0= p=0.7
Alternative: Ha= p not equal to 0.7

Type 1 error is stating that the null hypothesis is false, but that 70% of students actually do own an iphone.
Type 2 error is stating that 70% of students own an iphone, when that is not true.

The consequences include false statistics.",1,PSU_q2,,
R_22WeDg6HTWBCLub_PSU_q2,"Null is they arent associated Alt is they are associated.
Claim they are assoc when they are arent 
Claim rhey arent associated when they are
Claim wrong things about the data",0,PSU_q2,,
R_1mwlYTN4hjQ6J9M_PSU_q2,"So lets say we want to determine whether or not the test results from a patient in a hospital are indictive of if a patient is sick. we would want to (depending on the context) weed out the possibility for either a type one or type two error. 

A type one error is when you reject a null hypothesis that was actually true (a false positive) In the context of this example if we got a type one error that would imply a test result came back and it said the patient was sick when in reality they are not.

A type two error is when you don't reject a null hypothesis that is false (a false negative) In the context of this example if we got a type two error that would imply a test result came back and it said the patient wasn't sick when in reality they were.

The consequences of either situation are really bad, if we assume the patient was sick when they are in reality fine then the hospital may end up dishing out treatment that is expensive or unnecessary and if we arrive at a type two error then the hospital may end up releasing a potentially sick patient which means they may potentially spread that sickness to others.",2,PSU_q2,,
R_2WM8QbJ6HBgputQ_PSU_q2,"A null hypothesis is a result with no difference than what was expected.  An alternative hypothesis is a result with a difference for the null. 
A type one error is when a null is rejected when it is actually true. A type two error is when a null is accepted when it is false.
Consequences with errors can result in loss of time, loss of data, or incorrect assumptions about a population.",0,PSU_q2,,
R_3FJV3oLg9Ozfr5Y_PSU_q2,"describe the null and alternative hypotheses for the chosen example; testing a new drug with potentially dangerous side effects to see it it’s significantly better than the drug currently in use. if found to be better it will be prescribed to millions of people. Null Hypothesis (H0): The new drug is not significantly better than the current drug.
- Symbolically, we can represent this as H0: μnew = μcurrent, where μnew represents the population mean effectiveness of the new drug and μcurrent represents the population mean effectiveness of the current drug.

Alternative Hypothesis (Ha): The new drug is significantly better than the current drug.
- Symbolically, we can represent this as Ha: μnew > μcurrent, indicating that the population mean effectiveness of the new drug is greater than that of the current drug.

If the new drug is found to be significantly better, it could potentially be prescribed to millions of people.


explain the meaning of a type 1 error (i.e., a ""false positive"") in the chosen context; 
Type 1 Error (False Positive):
A Type 1 error occurs when we reject the null hypothesis (H0) when it is actually true. In other words, we conclude that the new drug is significantly better than the current drug when, in reality, there is no significant difference. This can lead to the incorrect adoption of the new drug, thinking it is superior, when it may not be. this could be dangerous and life threatening for those who may take the new drug thinking it’s helping when in reality it could be hurting them significantly. 

explain the meaning of a type 2 error (i.e., a ""false negative"") in the chosen context; 

Type 2 Error (False Negative):
A Type 2 error occurs when we fail to reject the null hypothesis (H0) when it is actually false. In this case, it would mean that we conclude that the new drug is not significantly better than the current drug, when in reality, it is. This can lead to the missed opportunity of providing a potentially more effective treatment to patients.
 

describe the potential consequences associated with each type of wrong decision (i.e., type 1 or type 2 error). 
Consequence of Type 1 Error: this could be widespread prescription of this new drug based on a false belief that it is better than the old one.this could result in dangerous side effects and an even greater risk for patients.
Consequence of Type 2 Error:
The potential consequence of a Type 2 error would be the continued use of the current drug, even though the new drug could offer better effectiveness. This could result in patients not receiving the potential benefits of the new drug and potentially prolonging their suffering or not achieving optimal treatment outcomes.
",2,PSU_q2,,
R_25EMk54xMijIMCT_PSU_q2,"A company is testing a new drug for effectiveness based on a previous drug. The null hypothesis states that the new drug might be equal to, or not equal to, equal as effective as the original one. The alternative hypothesis states that the new drug might be more effective than the previous drug. When discussing type 1 error, it's rejecting the null when it's true, so that would say that the new drug is more effective when it isn't, so consequences could be harm to patients. For type 2 error, it discusses failing to reject the null when it's false, so in this context it would mean that they wouldn't understand the effectiveness of the new drug versus the old drug, so again, harm to patients.",1,PSU_q2,,
R_xxW5R7zl1SQ7NQt_PSU_q2,"Null hypotheses: Music does not help students do homework more efficiently
Alternative hypotheses: Music does help students do homework more efficiently
A type 1 error would be: The test result says music helps students do homework but in reality it doesn't
A type 2 error would be: The test result says music does not help students do homework but in reality it does.
The potential consequences would be that it would lead to false results that would cause ""students"" in this case to use the wrong method while doing their homework.",1,PSU_q2,,
R_1drSzixxGNta9T2_PSU_q2,"""Elephants in Zoos""
null hypothesis: this is no difference in the average distance traveled/day when comparing the African to the Asian elephant.
alternative hypothesis: this is a difference in the average distance traveled/day when comparing the African to the Asian elephant.

type 1 error: we say that there is a difference in average distance traveled but there is not.
- consequence: false positive 
type 2 error: we say that there is not a difference in average distance traveled but there is.
- consequence: false negative",1,PSU_q2,,
R_3RsvNwBYFIIqHmo_PSU_q2,"the null hypothesis claims that there is no effect or no difference

the alternative hypothesis claims  for which we seek significant evidence that there is an effect or difference 

type 1 error is rejecting a true null (false positive)
type 2 error is not rejecting a false null (false negative)

type 1 error : a patient might get unnecessary treatments or medications because of the belief of the test result.

type 2 error : a patient might get proper treatments late because of believing in false result.",0,PSU_q2,,
R_pN0Kf2PV1bv9NYJ_PSU_q2,"- Null: Medicine has no effect on a patient. Alternative: Medicine did have an effect on the patient.
- Type one error: If someone who is not pregnant was told they are.
- Type two error: if someone who is pregnant is told they are not. 
- Type one: someone could think they have a serious illness they do not. Type two: someone could have a serious illness and continue untreated for it.",0,PSU_q2,,
R_VIsOGNMuwBGuf4Z_PSU_q2,"""do men go to the gym more than women""
Type 1 error reject Ho when it doesn't apply like saying there is enough evidence to prove men go to the gym more than women but there actually isnt. 
Type 2 error not reject Ho and say men and woman go to the gym the same amounts when thats not true",0,PSU_q2,,
R_bDSBaVn4SvBmZhL_PSU_q2,"describe the null and alternative hypotheses for the chosen example;
- Null hypothesis (H0): There's no effect in the population. Alternative hypothesis (Ha or H1): There's an effect in the population.
explain the meaning of a type 1 error (i.e., a ""false positive"") in the chosen context; 
- the error of rejecting a null. hypothesis when it is actually true.
explain the meaning of a type 2 error (i.e., a ""false negative"") in the chosen context;
- the error of not rejecting a null. hypothesis when the alternative hypothesis is the true state of nature. 
describe the potential consequences associated with each type of wrong decision (i.e., type 1 or type 2 error).
- With type 1 errors you are making an incorrect assumption and can lose time and resources. Type 2 errors can result in a missed opportunity to change, enhance, and innovate a project.",0,PSU_q2,,
R_1GOzuYaVdUVqBUI_PSU_q2,"I chose the lab for 4.4. The null is mu1=mu2 (mu1 is morality and mu2 is dental pain), and the alternative mu1>mu2. Type 1 error would be rejecting the null (mu1=mu2) when in reality the null is true. Type 2 error would be not rejecting the null (mu1=mu2) when the null is false (mu1 does not equal mu2). Potential consequences for type 1 error (a false positive) would be saying there is no association between morality and dental pain when there really is. And for a type 2 error (false negative), it would be saying the null is true and that there is an association when there isn't. Either error will lead to possible consequences as the chosen decisions will be wrong.",1,PSU_q2,,
