ResponseId,student_answer,label,q_id,label1,label2
R_3JC9UvoqX8ifLX7_PSU_q2,"Null hypothesis: There is no difference in the mean amount of weight lost when on a low carb diet.
Alternative hypothesis: The mean weight loss should be greater when someone is on a low carb diet.

A type 1 error would be rejecting the idea that there is no difference in the mean amount of weight lost when on a low carb diet when there really is a difference. 

A type 2 error would be failing to reject the idea that there is no difference in the mean amount of weight lost when the idea is actually not true. 

The consequences associated with a type one error is making an incorrect assumption that can harm people, when the consequence with a type 2 error is resulting in a missed opportunity to come across the right data or discovery in research.",0,PSU_q2,,
R_AvrTXp0elFzhaHD_PSU_q2,The null hypothesis of a study about wether rumors about professors have an effect. The alternative hypothesis would be a number not equal to 0 and a type one error would be rejecting the null when it is true while a type 2 error is not rejecting the null when you should reject it.,0,PSU_q2,,
R_z7H0x2Fw77lQnDz_PSU_q2,"An example of coronavirus testing samples. Null would be that it doesn't correctly indicate whether or not someone has it, and the alternative would be that it does. A type 1 would be a false positive, in where it says you have coronavirus, but don't, and a type 2, a false negative, would be that you don't have coronavirus, when you do. In this instance, a type one could lead people to take precautions they don't need to take, and a type two would result in someone who's sick, to not be aware that they are, which would be worse.",2,PSU_q2,,
R_2zIKgQSC515vGgH_PSU_q2,"The situation would be if more men than women voted where p1 is men and p2 is women. The null would be H0: p1=p2 because we would expect there to be no difference between the two groups. The alternative would be p1>p2 because we are testing to see if more men voted than women. A type one error would mean that we get results that more men voted than women, but in reality that was not true. A type two error would mean that we get results that say there is no difference or that women vote more, but in reality men do vote more. A type one error would lead to false statistics being spread around that men vote more than women. This would not harm anyone, but it would be a lie. A type two error would result in the same thing where a false statistic or lack of statistic would be spread around, and men would not know that they actually vote more.",2,PSU_q2,,
R_27alEj8j0hlJK9T_PSU_q2,"Null: Student did cheat. Alternative: Student did not cheat
Type 1 error: Admissions Officer claims the student did not cheat, when really the student did cheat.
Type 2 error: Admissions Officer claims the student did cheat, when really the student did not cheat.
Potential consequences: A student applying to college would be most bothered about a type 2 error. An admission officer would be most bothered by a type 1 error.",0,PSU_q2,,
R_1dug9pUOpyiMdHT_PSU_q2,"- 200 were tested to see on average if they get more sleep time or screen time 

null hypothesis: p=0.5  alternativve: p not= 0.5
type one error is when we have a all hypothesis that got rejected but we have evidence that we cannot reject 
type ii is when we have a null that was not rejected but we have evidence to reject 

",0,PSU_q2,,
R_1GxdlvPD3bMTfd4_PSU_q2,"The coin flip example:
H0: P = 0.5
Ha: P ≠ 0.5

Type 1 Error: rejecting a true null (false positive) → in the coin flip, we conclude that the coin is not fair when in fact it is 
Type 2 Error: is not rejecting a false null (false negative) --> we fail to reject the null that it is fair, when in fact it is not fair 


",1,PSU_q2,,
R_1esiGbza5Thh6Qv_PSU_q2,"The null hypothesis can be that light exposure has no effect on plant growth, and the alternative can be that light exposure has a positive effect of plant growth
Type 1 error: That we say that light exposure has no effect on plant growth but it really does
Type 2 error: That we say that light exposure has no effect on plant growth when it really doesn't
The potential consequences associated with the wrong decision could be that you wont give your plant light exposure when it really needs it if the directions on that plant (that are wrong) say that it needs low light (type 1 error) then your plant will die.",2,PSU_q2,,
R_1JJ7B2FT0AGtaBz_PSU_q2,"
Null and Alternative Hypotheses:
   - Null Hypothesis (H₀): The patient does not have the disease.
   - Alternative Hypothesis (H₁): The patient has the disease.
Type 1 Error (False Positive):
   - A Type 1 error in this context would mean incorrectly rejecting the null hypothesis and concluding that the patient has the disease when, in reality, they do not. This is akin to a ""false positive"" diagnosis.

Type 2 Error (False Negative):
   - A Type 2 error would occur if we fail to reject the null hypothesis when the patient actually has the disease. In other words, the test erroneously indicates that the patient is disease-free, a ""false negative"" result.

Consequences of Errors:
   - **Type 1 Error (False Positive):** The patient might undergo unnecessary treatments, causing emotional distress and potential side effects. Additionally, healthcare resources could be misallocated.
   
Type 2 Error (False Negative): The patient may not receive timely treatment, allowing the disease to progress undetected, potentially leading to serious health complications. Furthermore, public health efforts might not be adequately targeted.

In this medical context, achieving a balance between minimizing both types of errors is crucial. The consequences associated with each type of error emphasize the importance of carefully considering the implications of hypothesis testing outcomes, as they directly impact individuals' health and the efficient allocation of healthcare resources.
",2,PSU_q2,,
R_2aDoM7IzXMbGYBN_PSU_q2,"Are females more likely than males to say they support universal paid parental leave?
The null hypothesis would be H_O: p = 0, H_A: p > 0 
The false positive would be that we can reject the null when in reality we should be failing to reject the null. We would basically be saying that the support for paid parental leave would have no difference when in reality there should be a difference. 
The false negative would be saying that there is a difference in the support for paid parental leave when in reality there is no difference. 
The false positive could lead to be giving the wrong information about the support, that there is actually a difference in support and the false positive would be saying that there is no difference in support and females and males feel the same about parental leave pay. The false negative would be that there is a difference in support, more females are in favor of paid parental leave than men are.",0,PSU_q2,,
R_72kRFunhVD3NdMB_PSU_q2,"When testing to see if tea affects a particular hormone/chemical more than coffee, the null hypothesis would be that they have identical affects (mean1-mean2 = 0), and the alternative hypothesis is that tea affects more, meaning that mean1(tea) - mean2(coffee) > 0. A type 1 error would mean that we said that tea affects the chemical more, when it doesn't, and a type 2 error would mean that we said that tea does not affect the chemical more, when it does. The consequences of a type one error, I feel, are a lot more dangerous, especially when you are working with a medication. If a medication has bad side affects, and we have a false positive that says it is affective when it isn't, that is very dangerous for whoever is taking the medication. A type 2 error falls more along the lines of ""Making this error means that people don't benefit from a beneficial drug"" which while disappointing, is not as liable to hurt someone",2,PSU_q2,,
R_1jpO1xjNUPpAU79_PSU_q2,The null hypothesis is: There is no correlation between where you sit in class and your grades. The alternative hypothesis is that there is a correlation between where you sit in class and your grades. A type 1 error in this situation is if you get evidence that there is a correlation between the 2 variables but there is not a correlation. A type 2 error in this situation is if you do not get evidence of a correlation but the varaibles are correlated. The consequences of both errors are  spreading false information.,0,PSU_q2,,
R_xz1BSoCk06QyUxP_PSU_q2,"1. Null Hypothesis(H0): The new drug does not affect lowering blood pressure.
    Alternative Hypothesis (H1): The new drug is effective in lowering blood pressure.

2. In this context, a Type I error would occur if we incorrectly reject the null hypothesis, concluding that the new drug is effective when it has no impact on blood pressure. This is a ""false positive"" or the erroneous belief that the drug works.

3. A Type II error would happen if we fail to reject the null hypothesis, concluding that the drug has no effect when it does indeed lower blood pressure. This is a ""false negative"" or the failure to recognize the drug's effectiveness.

4. 1) Type I Error:
Potential consequence: Patients might be prescribed the new drug, incurring unnecessary costs and potential side effects, believing it helps when it doesn't.
     2) Type II Error:
Potential consequence: Patients might miss the opportunity to benefit from a genuinely effective drug, leading to untreated high blood pressure and associated health risks.

Understanding and minimizing Type I and Type II errors are crucial in such scenarios, as these errors can have significant real-world implications for patient well-being and healthcare resources.
",2,PSU_q2,,
R_3fDbEr3r1KihaJ1_PSU_q2,"Ho: p=0.5
Ha: p>0.5

In lab 4.2 activity 1, the hypotheses assess whether the accuracy of Punxsutawney Phil's predictions are due to chance or more than chance.

A type 1 error in this case would be assuming that the alternative hypothesis, that his predictions are better than chance, is true, when in reality his predictions are solely due to chance.

A type 2 error in this case would be assuming that the null hypothesis, that his predictions are due to chance, is true, when in reality his predictions are more accurate than chance. 

A type 1 mistake would entail more people believing in his predictions and being fooled into believing him when he is really just guessing. A type 2 error would entail people losing their faith in Phil when he actually does have some ability to predict the weather.",2,PSU_q2,,
R_31ZqDmFX1Ld13SF_PSU_q2,"Null: ""Site"" and ""Amount of Sunlight"" are not associated.
Alternative: ""Site"" and ""Amount of Sunlight"" are associated.

Type I error: We initially rejected the null and found that ""Site"" and ""Amount of Sunlight"" are associated when in reality, they are not.
Type II error: We initially failed to reject the null and found that ""Site"" and ""Amount of Sunlight"" are not associated when in reality, they are.

A potential consequence for type I is that it can mislead people into believing that there is more sunlight based on the place when really there is not. A potential consequence for type II is that a certain site could have other variables changed to find an association when they really do have one with light.",1,PSU_q2,,
R_ZBQYkqj8OZwF7fH_PSU_q2,"One example from a previous lecture would have to be the analogy of us criminal law.  The null for this hypothesis is the person being innocent and the alternative is ""until proven guilty"".
The type one error in this scenario would be convicting an innocent person and the type two would be releasing a guilty person.",0,PSU_q2,,
R_PU6vYPkS4venCzD_PSU_q2,"1. The null hypothesis is something we try to test against. The alternative hypothesis represents the researcher's claim. 
2. A type 1 error is when you think something is working but it isn't. Say a doctor prescribed you a medicine that you don't need. You were wrongfully prescribed and now you are taking something that might harm you. 
3. A type 2 error is when you aren't doing something that will help you. Say now, you have the disease and aren't prescribed the medicine. 
4. Both errors are bad and can lead to consequences as I explained above.",0,PSU_q2,,
R_2SqKd0Ma09toyoB_PSU_q2,"Percentage of guys that sit in the front of the class. The null hypothesis might be a p = a sample statistic. The alternative hypothesis might be a p not = the sample statistic. This two tailed test is jut looking for a change. A type one error would be incorrectly rejected the null hypothesis. This means saying p not = sample stat, when in reality it does. A type two error is when a false null hypothesis is not rejected. This would be not rejected p = sample stat, when it really does not equal the sample stat. Consequences that come with this could be detrimental to society, especially if dealing with medicine or public health.",1,PSU_q2,,
R_1cUGtsOcx37eqv6_PSU_q2,"Suppose a pharmaceutical company wants to test the effectiveness of a new drug when compared to an old drug. The new drug is less expensive to produce, but may cause harmful side effects. They create two hypotheses. The null hypothesis states that there is no difference between the new drug and the old drug. The alternative hypothesis states that the new drug is more effective than the old drug. If the pharmaceutical company makes a type 1 error, they will find evidence that the new drug is better when both drugs are actually equal. Therefore, the company would be releasing a drug that causes harmful side effects for no good reason. If the company makes a type 2 error, they will not find evidence that the new drug is better even though it is. Therefore, they will be withholding a beneficial drug from people who could benefit from it.",2,PSU_q2,,
R_qx8RAJyKvOEFGtr_PSU_q2,"If you measured the average amount of texts sent between men and women. 

the null would be if the same amount of texts between both groups. 
the alternative would be if the amounts were unequal.
a type 1 error would be is you said women sent more texts when they text amounts were equal 
a type 2 could be if you said the amount of texts were equal but in reality, there were more texts sent by men. 

The consequences of a type 1 is failing to report a positive result, and for a type 2 is failing to report a negative result. 
",1,PSU_q2,,
R_Didk7Y1qHyzhdpn_PSU_q2,"An example discussed in class was if males are more likely to attend football games in Beaver Stadium. The null hypothesis is the proportion of males who attend football games in Beaver Stadium is equal to the proportion of females. The alternative hypothesis is the proportion of males who attend football games in Beaver Stadium is equal to the proportion of females. A type one error is when you reject the null, saying there is evidence for the alternative when there really isn't. In this example saying there is evidence that the proportion of males who attend football games in Beaver Stadium is greater than that of females, when really there isn't evidence for that.  A type two error is when you fail to reject the null, but there was evidence for the alternative. In this example, concluding that the same proportion of males and females attend games in Beaver stadium, when actually there is evidence that males attend more.",1,PSU_q2,,
R_2f1gLfpkbLAQjU0_PSU_q2,"Null: The New Drug’s Effectiveness Mean =  the Current Drugs Effectiveness Mean 
Alternative: The New Drug’s Effectiveness Mean > the Current Drugs Effectiveness Mean 
 
A Type I error occurs when you incorrectly reject the null hypothesis when it is actually true. So the null hypothesis might be that the new drug is not significantly better or is equivalent in effectiveness to the current drug. So, making a Type I error would mean concluding that the new drug is significantly better when it's not. This could lead to the approval of a drug that is not more effective and. A Type II error occurs when you fail to reject the null hypothesis when it is actually false. This would mean failing to conclude that the new drug is significantly better when, in fact, it is. Making a Type II error would result in the new drug not being approved or not replacing the current drug, even though it could offer significant benefits.",2,PSU_q2,,
R_3qw0iqqXek4EOIi_PSU_q2,"An example from a lab in class:

Do young adults want to spend more minutes talking with their parents when they are thinking about mortality as opposed to dental pain?

null: mu1 - mu2 =0

The null hypothesis would be that there is no difference in the amount of time young adults talk to their parents between thinking about dental pain and mortality.

alternative: mu1 - mu2 > 0

The alternative hypothesis would be that young adults spend more time talking to their parents when they are thinking about mortality than they do about dental pain.

The meaning of a type 1 error would be if we conclude that there is a difference in the amount of time young adults speak with their parents when thinking about mortality as opposed to dental pain, when in fact there is really no difference.

The meaning of a type 2 error would be if we conclude that there is no difference in the amount of time young adults speak with their parents when thinking about mortality as opposed to dental pain, when in fact there really is a difference. 

A type 1 error is a wrongful assumption (false positive) that the hypothesis test is working even though it isn't. This is a worse error to make. A type 2 error is concluding that something has no effect when it really does, leading to lost time and resources.
",1,PSU_q2,,
R_1d5YBjM9M73zctA_PSU_q2,"there is a positive correlation between students who work a greater amount of hours

 the number of hours students work and the number of classes they miss has no positive correlation is the null hypothesis 

the number of hours students work and the number of classes they miss has a positive correlation is the alternative hypothesis

A Type 1 error would lead to the belief that working more hours is associated with missing more classes when no correlation exists. This would occur if we wrongly conclude that there is a positive correlation when there is no relationship. 

Overlooking an actual relationship between working more hours and missing more classes if we fail to reject a true positive correlation that would lead to a Type 2 error.

Type 1 Error consequences is incorrectly assuming a positive correlation may lead to misguided interventions or policies aimed at addressing an issue that doesn't actually exist.

consequences that stem from Type 2 Errors are overlooking a positive correlation could result in a lack of appropriate measures to students who work more hours and may need assistance in managing their class attendance.





",2,PSU_q2,,
R_26hdEoGQzromkVn_PSU_q2,"Null Hypothesis: The coin is fair, meaning it has an equal probability of landing heads or tails. 
Alternate Hypothesis: The coin is biased, meaning it does not have an equal probability of landing heads and tails.
Type 1 error: Would happen if we reject the null hypothesis and conclude that the coin is biased (Ha) when, in reality, the coin is fair (H0). This means we incorrectly identify a fair coin as biased.
Type 2 Error: would happen when we fail to reject the null hypothesis (H0) and conclude that the coin is fair when, in fact, the coin is biased (Ha). This means we fail to detect that the coin is not fair.
Potiential consequences:
Type 1- Unwarranted suspicion that the coin is biased, potentially leading to unnecessary investigations or actions.
Type 2- Use of a biased coin, potentially leading to unfair outcomes in games or decisions that rely on coin flips.",2,PSU_q2,,
R_10MzCUHGGfa79y5_PSU_q2,"In class, we did an example that hypothesized that resveratrol may decrease body mass. body mass was taken before resveratrol supplementation (B) and after supplementation (A). Null hypothesis: muB= muA and alternative hypothesis: muB > muA. Type 1 error in this case would mean the null is rejected and conclusions come out that resveratrol supplement does decrease body mass by decreasing food intake, but in reality, the null hypothesis is true. Type 2 would be we do not reject the null hypothesis but the null was false. potential consequences associated with type one would be that people think resveratrol is helping them lose body mass but it's not.",1,PSU_q2,,
R_XFGAYm22xRMEQKJ_PSU_q2,".Null: There is no change in average salary between males and females: mu=0
. Alternative: Males make more than females: mu does not = 0

Type 1 error would be saying there is a difference when there is not
Type 2 error would be saying there isn't a difference when there is

Type 1 consequences can lead to assuming the information given is significant when there isn't anything significant and type 2 errors lead to false negatives which means claiming a significant value as insignificant.",0,PSU_q2,,
R_2zHeG8U0H4bmt0Z_PSU_q2,"- The null hypothesis is often stated as the assumption that there is no change, while the alternative hypothesis is the statement that there is a change.
- A type 1 error occurs when you reject the null hypothesis even though the null is true.
- A type 2 error occurs when you fail to reject the null hypothesis even though the null is not true.
- A type 1 error is a false positive, while a type 2 error is a false negative",1,PSU_q2,,
R_3jfcG7sAwkGtSyg_PSU_q2,"Example: Researchers are testing to see if a new prescription drug can improve the memory of  elderly adults. Half of the patients have a placebo, while the other half are taking the new drug. The mean is the average change in mental test scores, with a low score being very little loss of mental capacity, and a negative score being an increase in mental capacity.

Null Hypothesis: Mean(drug) - Mean(placebo) = 0
Alternate Hypothesis: Mean(drug) - Mean(placebo) < 0

Type 1 Error: The drug is assumed to be effective, when it is actually not. The consequences of this could be the drug company getting into trouble for selling a product that doesn't actually work.

Type 2 Error: The drug is assumed to be ineffective, when it actually is effective. The consequences of this could be the drug company cancelling the production on a medicine that could have benefitted people.",2,PSU_q2,,
R_11ZSlGdTcRG32gt_PSU_q2,"The US criminal system: You are innocent until proven guilty
Ho: Innocent
Ha: You are found guilty
Type 1 Error: false positive. You are convicted even though you didn't do anything
Type 2 Error: False negative You are released even though you did something 

",0,PSU_q2,,
R_2U3h4JHWkC5ITKA_PSU_q2,"The example I use was ""Regarding pets, are dog owners more likely to be extroverted when compared to cat owners?""
The type 1 error means we think dog owners did more likely to be extroverted while actually it is not.
The type 2 error means when we fail to approve this assume when dog owners are actually more extroverted. 
Statistical hypothesis testing aims to control these errors. However, minimizing one type of error often leads to an increase in the other type. Balancing these errors depends on the specific context and the consequences of making each type of mistake.",0,PSU_q2,,
R_2OI77PY5Sy4le8e_PSU_q2,"""Testing to see if a proportion is greater than .3""
Ho: p=0.3 Ha: p> 0.3
Type 1: said that p>0.3 but it really is not
Type 2: did not say p>0.3 when it really is
",1,PSU_q2,,
R_26f2Io9DmLeg91n_PSU_q2,"The null hypothesis for does eating pizza increase your weight by 5 pounds, is p=5, and the alternative hypothesis is p doesn't equal 5. 

A type one error is when you reject the null hypothesis so they are statistically different, but in reality there is no difference.
A type 2 error is when you do no reject the null hypothesis, so they are not statistically different, but in reality there is a difference.
The consequences associated with each type is they can be correct but in reality be wrong. You can't trust experiments if they have a type error.",0,PSU_q2,,
R_1DGf2xL6ICEvc2q_PSU_q2,"1. Determining the null is false when it is positive
2. Determining the null is true when it is false 
3. saying the stat is significant when it isnt and vice versa",0,PSU_q2,,
R_3NVVLty6OHFmrC7_PSU_q2,"Class Example from a lab: We are testing a new drug with potentially dangerous side effects to see if it is significantly better than the drug currently in use. If it is found to be more effective, it will be prescribed to millions of people.

Null: Ho: p=0

Alternative: Ha: p does not = 0

Type I: This is when one rejects a null that is true. In this example, we would reject the null because we believe that the new drug is more effective than the old drug, when in reality, it isn't. Potential consequences associated with this error would be giving out an ineffective drug with potentially dangerous side effects to millions of people.

Type II: This error occurs when you fail to reject a null that is false. In this example, we would believe that the new drug isn't any better than the old drug, when in reality it is. Potential consequences associated with this error would be withholding a drug that would actually help millions of people.",0,PSU_q2,,
R_Qm2ScsTgFjL2Rkl_PSU_q2,"Null hypothesis _ p=0 and alternative p>0 : proportion of pregnancy test results that are accurate

Type ! is we reject a true hypothesis - consequence people think they are pregnant when they aren't
Type II we accept a false hypothesis - consequence people think they aren't pregnant when they are",1,PSU_q2,,
